{
  "schema_version": "1.0.0",
  "type": "job",
  "id": "https://example.com/jobs/llm-pages-engineer",
  "source_url": "https://example.com/jobs/llm-pages-engineer",
  "title": "Software Engineer, LLM Pages",
  "language": "en",
  "summary": "Own the LLM Pages stack and build reference implementations.",
  "tags": ["engineering", "standards"],
  "last_modified": "2025-08-24T13:00:00Z",
  "content_version": "1.0.0",
  "page_checksum": "jobchecksum1234567890abcdefghijklmnopqrstuvwxyz==",
  "license": "CC-BY-4.0",
  "publisher": { "name": "Example Corp", "url": "https://example.com" },
  "content": {
    "company": "Example Corp",
    "location": "Remote",
    "remote": true,
    "employment_type": "full_time",
    "salary": { "min": 150000, "max": 220000 },
    "currency": "USD",
    "equity": true,
    "experience_level": "senior",
    "description": "You will design and build...",
    "requirements": ["5+ years TypeScript", "Experience with JSON Schema"],
    "nice_to_have": ["Next.js", "Security & signing"],
    "apply_url": "https://example.com/jobs/llm-pages-engineer/apply"
  }
}

